{
  "nodeId": "node-mini",
  "publicOrigin": "https://remote-mini.example.com",
  "localDevice": {
    "id": "mac-mini",
    "label": "Mac mini",
    "targetOS": "macOS",
    "upstreamHost": "host.docker.internal",
    "upstreamPort": 5900,
    "credentialRef": "/run/secrets/vnc_password"
  },
  "bookmarks": [
    {
      "id": "mac-air",
      "label": "MacBook Air",
      "url": "https://remote-air.example.com/",
      "status": "UNVERIFIED"
    }
  ]
}
